supply_tech,geography,definition,reference_tech_id,input_unit,output_unit,interpolation_method,extrapolation_method,extrapolation_growth,age_growth_or_decay_type,age_growth_or_decay,source,notes
Onshore wind power plant,us,absolute,,Btu,Btu,linear_interpolation,nearest,,,,,
offshore wind power plant,us,absolute,,Btu,Btu,linear_interpolation,nearest,,,,,
pulverized coal power plant,state,absolute,,Btu,kilowatt_hour,linear_interpolation,nearest,,,,,
central hydrogen grid electrolysis,us,absolute,,kilowatt_hour,h2_kilogram,linear_interpolation,nearest,,,,,
central solar thermo hydrogen production,us,absolute,,kilowatt_hour,h2_kilogram,linear_interpolation,nearest,,,,,
pipeline gas compression and fueling station,us,absolute,,mmBtu,mmBtu,linear_interpolation,nearest,,,,GREET,
pipeline gas LNG fueling station,us,absolute,,mmBtu,mmBtu,linear_interpolation,nearest,,,,GREET,
purpose-built liquefiers,us,absolute,,mmBtu,mmBtu,linear_interpolation,nearest,,,,GREET,
hydrogen fueling station,us,absolute,,kWh,h2_kilogram,linear_interpolation,nearest,,,,,
thermal biomass gasifier,us,absolute,,mmBtu,mmBtu,linear_interpolation,nearest,,,,,
lignocellulosic anaerobic digester,us,absolute,,mmBtu,mmBtu,linear_interpolation,nearest,,,,,assumes remaining lignin converted to electricity at 33% efficiency
Fischer-Tropsch bio-diesel plant,us,absolute,,mmBtu,mmBtu,linear_interpolation,nearest,,,,,
Fast-pyrolysis bio-diesel plant,us,absolute,,mmBtu,mmBtu,linear_interpolation,nearest,,,,,ignores produced bio-char
Hydrothermal liquefaction and hydrotreating,us,absolute,,mmBtu,mmBtu,linear_interpolation,nearest,,,,,http://www.etsap.org/E-techDS/PDF/I01-ind_boilers-GS-AD-gct1.pdf
Hydroprocessed Renewable Oil  Plant,us,absolute,,mmBtu,mmBtu,linear_interpolation,nearest,,,,,ignores naptha byproduct
Industrial Coal Boiler,us,absolute,,mmBtu,mmBtu,linear_interpolation,nearest,,,,,http://www.etsap.org/E-techDS/PDF/I01-ind_boilers-GS-AD-gct1.pdf
Industrial Residual Fuel Oil Oil Boiler,us,absolute,,mmBtu,mmBtu,linear_interpolation,nearest,,,,,http://www.etsap.org/E-techDS/PDF/I01-ind_boilers-GS-AD-gct1.pdf
Industrial Pulping Liquors Oil Boiler,us,absolute,,mmBtu,mmBtu,linear_interpolation,nearest,,,,,http://www.etsap.org/E-techDS/PDF/I01-ind_boilers-GS-AD-gct1.pdf
Industrial Distillate Fuel Oil Boiler,us,absolute,,mmBtu,mmBtu,linear_interpolation,nearest,,,,,http://www.etsap.org/E-techDS/PDF/I01-ind_boilers-GS-AD-gct1.pdf
Industrial Woody Biomass Boiler,us,absolute,,mmBtu,mmBtu,linear_interpolation,nearest,,,,,http://www.etsap.org/E-techDS/PDF/I01-ind_boilers-GS-AD-gct1.pdf
Industrial Pipeline Gas Boiler,us,absolute,,mmBtu,mmBtu,linear_interpolation,nearest,,,,,http://www.etsap.org/E-techDS/PDF/I01-ind_boilers-GS-AD-gct1.pdf
Industrial Petroleum Coke Boiler,us,absolute,,mmBtu,mmBtu,linear_interpolation,nearest,,,,,http://www.etsap.org/E-techDS/PDF/I01-ind_boilers-GS-AD-gct1.pdf
Industrial LPG Boiler,us,absolute,,mmBtu,mmBtu,linear_interpolation,nearest,,,,,http://www.etsap.org/E-techDS/PDF/I01-ind_boilers-GS-AD-gct1.pdf
Industrial Other Petroleum Boiler,us,absolute,,mmBtu,mmBtu,linear_interpolation,nearest,,,,,http://www.etsap.org/E-techDS/PDF/I01-ind_boilers-GS-AD-gct1.pdf
nuclear power plant,us,absolute,,Btu,kilowatt_hour,linear_interpolation,nearest,,,,,
large hydro power plant,us,absolute,,kilowatt_hour,kilowatt_hour,linear_interpolation,nearest,,,,,
run of river hydro power plant,us,absolute,,kilowatt_hour,kilowatt_hour,linear_interpolation,nearest,,,,,
gas combined cycle power plant,state,absolute,,Btu,kilowatt_hour,linear_interpolation,nearest,,,,,
gas combustion turbine power plant,state,absolute,,Btu,kilowatt_hour,linear_interpolation,nearest,,,,,
gas steam turbine power plant,state,absolute,,Btu,kilowatt_hour,linear_interpolation,nearest,,,,,
gas combined cycle power plant with CCS,us,absolute,,Btu,kilowatt_hour,linear_interpolation,nearest,,,,,
coal steam turbine power plant with CCS,us,absolute,,Btu,kilowatt_hour,linear_interpolation,nearest,,,,,
rooftop solar PV power plant,us,absolute,,kilowatt_hour,kilowatt_hour,linear_interpolation,nearest,,,,,
distribution-sited solar PV power plant,us,absolute,,kilowatt_hour,kilowatt_hour,linear_interpolation,nearest,,,,,
transmission-sited solar PV power plant,us,absolute,,kilowatt_hour,kilowatt_hour,linear_interpolation,nearest,,,,,
geothermal power plant,us,absolute,,Btu,kilowatt_hour,linear_interpolation,nearest,,,,,
biomass power plant,state,absolute,,Btu,kilowatt_hour,linear_interpolation,nearest,,,,,
solar thermal without energy storage power plant,us,absolute,,kilowatt_hour,kilowatt_hour,linear_interpolation,nearest,,,,,
coal IGCC power plant,state,absolute,,Btu,kilowatt_hour,linear_interpolation,nearest,,,,,
coal IGCC with CCS power plant,us,absolute,,Btu,kilowatt_hour,linear_interpolation,nearest,,,,,
petroleum coke steam turbine power plant,state,absolute,,Btu,kilowatt_hour,linear_interpolation,nearest,,,,,
distillate oil combustion turbine power plant,state,absolute,,Btu,kilowatt_hour,linear_interpolation,nearest,,,,,
distillate oil steam turbine power plant,state,absolute,,Btu,kilowatt_hour,linear_interpolation,nearest,,,,,
residual oil steam turbine power plant,state,absolute,,Btu,kilowatt_hour,linear_interpolation,nearest,,,,,
fossil waste steam turbine power plant,state,absolute,,Btu,kilowatt_hour,linear_interpolation,nearest,,,,,
pumped hydro storage,us,absolute,,kilowatt_hour,kilowatt_hour,linear_interpolation,nearest,,,,,
8 - hour bulk battery storage,us,absolute,,kilowatt_hour,kilowatt_hour,linear_interpolation,nearest,,,,,
fuel cell power plant,state,absolute,,Btu,kilowatt_hour,linear_interpolation,nearest,,,,,
landfill gas to electricity power plant,state,absolute,,Btu,kilowatt_hour,linear_interpolation,nearest,,,,,
municipal solid waste power plant,state,absolute,,Btu,kilowatt_hour,linear_interpolation,nearest,,,,,
coal steam turbine cogen power plant,us,absolute,,Btu,Btu,linear_interpolation,nearest,,,,,
petroleum coke steam turbine cogen power plant,us,absolute,,Btu,Btu,linear_interpolation,nearest,,,,,
gas combined cycle cogen power plant,us,absolute,,Btu,Btu,linear_interpolation,nearest,,,,,
gas steam turbine cogen power plant,us,absolute,,Btu,Btu,linear_interpolation,nearest,,,,,
residual oil steam turbine cogen power plant,us,absolute,,Btu,Btu,linear_interpolation,nearest,,,,,
fossil waste steam turbine cogen power plant,us,absolute,,Btu,Btu,linear_interpolation,nearest,,,,,
biomass cogen power plant,us,absolute,,Btu,Btu,linear_interpolation,nearest,,,,,
landfill gas cogen power plant,us,absolute,,Btu,Btu,linear_interpolation,nearest,,,,,
municipal solid waste cogen power plant,us,absolute,,Btu,Btu,linear_interpolation,nearest,,,,,
solar thermal with energy storage power plant,us,absolute,,kilowatt_hour,kilowatt_hour,linear_interpolation,nearest,,,,,
gas combustion turbine cogen power plant,us,absolute,,Btu,Btu,linear_interpolation,nearest,,,,,
distillate oil combustion turbine cogen power plant,us,absolute,,Btu,Btu,linear_interpolation,nearest,,,,,
distllate oil steam turbine cogen power plant,us,relative,55.0,Btu,Btu,linear_interpolation,nearest,,,,,
residual oil combustion turbine power plant,state,absolute,,Btu,kilowatt_hour,linear_interpolation,nearest,,,,,
residual oil combustion turbine cogen power plant,us,relative,55.0,Btu,Btu,linear_interpolation,nearest,,,,,
Corn Ethanol Plant,us,absolute,,Btu,Btu,linear_interpolation,nearest,,,,AEO Liquid Fuels Module,
coal steam turbine IPP cogen power plant,us,absolute,,Btu,Btu,linear_interpolation,nearest,,,,,
gas combined cycle IPP cogen power plant,us,absolute,,Btu,Btu,linear_interpolation,nearest,,,,,
gas combustion turbine IPP cogen power plant,us,absolute,,Btu,Btu,linear_interpolation,nearest,,,,,
gas steam turbine IPP cogen power plant,us,absolute,,Btu,Btu,linear_interpolation,nearest,,,,,
residual oil combustion turbine IPP cogen power plant,us,absolute,,Btu,Btu,linear_interpolation,nearest,,,,,
distillate oil combustion turbine IPP cogen power plant,us,absolute,,Btu,Btu,linear_interpolation,nearest,,,,,
biomass cogen IPP power plant,us,absolute,,Btu,Btu,linear_interpolation,nearest,,,,,
Advanced Nuclear Plant,us,absolute,,Btu,kilowatt_hour,linear_interpolation,nearest,,,,,
distributed battery storage,us,absolute,,kilowatt_hour,kilowatt_hour,linear_interpolation,nearest,,,,,
power-to-gas methanation,us,absolute,,kilowatt_hour,kilowatt_hour,linear_interpolation,nearest,,,,,
gas cogen composite power plant,us,absolute,,Btu,Btu,linear_interpolation,nearest,,,,,
Generic Demand Response,us,absolute,,Btu,Btu,linear_interpolation,nearest,,,,,
Electrode Boiler,us,absolute,,Btu,Btu,linear_interpolation,nearest,,,,,
H2 Natural Gas Reformation ,us,absolute,,gigajoule,h2_kilogram,linear_interpolation,nearest,,,,,
H2 Natural Gas Reformation w/ccs,us,absolute,,gigajoule,h2_kilogram,linear_interpolation,nearest,,,,,
thermal biomass gasifier w/ccs,us,absolute,,mmBtu,mmBtu,linear_interpolation,nearest,,,,,
lignocellulosic anaerobic digester w/ccs,us,absolute,,Btu,Btu,linear_interpolation,nearest,,,,,
Fischer-Tropsch bio-diesel plant w/ccs,us,absolute,,Btu,Btu,linear_interpolation,nearest,,,,,
Fast-pyrolysis bio-diesel plant w/ccs,us,absolute,,Btu,Btu,linear_interpolation,nearest,,,,,
Hydrothermal liquefaction and hydrotreating w/ccs,us,absolute,,Btu,Btu,linear_interpolation,nearest,,,,,
Hydroprocessed Renewable Oil  Plant w/ccs,us,absolute,,Btu,Btu,linear_interpolation,nearest,,,,,
Relicensed Nuclear Power Plants,us,relative,25.0,,,,,,,,,
coal steam turbine cogen power plant w/ccs,us,absolute,,Btu,Btu,linear_interpolation,nearest,,,,,
petroleum coke steam turbine cogen power plant w/ccs,us,absolute,,Btu,Btu,linear_interpolation,nearest,,,,,
gas combined cycle cogen power plant w/ccs,us,absolute,,Btu,Btu,linear_interpolation,nearest,,,,,
gas steam turbine cogen power plant w/ccs,us,absolute,,Btu,Btu,linear_interpolation,nearest,,,,,
residual oil steam turbine cogen power plant w/ccs,us,absolute,,Btu,Btu,linear_interpolation,nearest,,,,,
fossil waste steam turbine cogen power plant w/ccs,us,absolute,,Btu,Btu,linear_interpolation,nearest,,,,,
biomass cogen power plant w/ccs,us,absolute,,Btu,Btu,linear_interpolation,nearest,,,,,
landfill gas cogen power plant w/ccs,us,absolute,,Btu,Btu,linear_interpolation,nearest,,,,,
municipal solid waste cogen power plant w/ccs,us,absolute,,Btu,Btu,linear_interpolation,nearest,,,,,
gas combustion turbine cogen power plant w/ccs,us,absolute,,Btu,Btu,linear_interpolation,nearest,,,,,
distillate oil combustion turbine cogen power plant w/ccs,us,absolute,,Btu,Btu,linear_interpolation,nearest,,,,,
coal steam turbine IPP cogen power plant w/ccs,us,absolute,,Btu,Btu,linear_interpolation,nearest,,,,,
gas combined cycle IPP cogen power plant w/ccs,us,absolute,,Btu,Btu,linear_interpolation,nearest,,,,,
gas combustion turbine IPP cogen power plant w/ccs,us,absolute,,Btu,Btu,linear_interpolation,nearest,,,,,
gas steam turbine IPP cogen power plant w/ccs,us,absolute,,Btu,Btu,linear_interpolation,nearest,,,,,
residual oil combustion turbine IPP cogen power plant w/ccs,us,absolute,,Btu,Btu,linear_interpolation,nearest,,,,,
distillate oil combustion turbine IPP cogen power plant w/ccs,us,absolute,,Btu,Btu,linear_interpolation,nearest,,,,,
biomass cogen IPP power plant w/ccs,us,absolute,,Btu,Btu,linear_interpolation,nearest,,,,,
Wave Power Plant,us,absolute,,Btu,Btu,linear_interpolation,nearest,,,,,
HQ hydro power plants,us,absolute,,kilowatt_hour,kilowatt_hour,linear_interpolation,nearest,,,,,
6 - hour bulk battery storage,us,relative,47.0,,,,,,,,,
4 - hour bulk battery storage,us,relative,47.0,,,,,,,,,
2 - hour bulk battery storage,us,relative,47.0,,,,,,,,,
6 - hour distributed battery storage,us,absolute,,kilowatt_hour,kilowatt_hour,linear_interpolation,nearest,,,,,
4 - hour distributed battery storage,us,relative,179.0,,,,,,,,,
2 - hour distributed battery storage,us,relative,179.0,,,,,,,,,
Cellulosic Ethanol Plant,us,absolute,,Btu,Btu,linear_interpolation,nearest,,,,,
